{"$id":"https://surfaces.dev/schemas/surfaceops-kanban-live/kanban-cards-api-manifest.v0.schema.json","$schema":"https://json-schema.org/draft/2020-12/schema","additionalProperties":false,"properties":{"auth":{"additionalProperties":true,"type":"object"},"authority":{"additionalProperties":true,"type":"object"},"endpoints":{"items":{"additionalProperties":false,"properties":{"allowedForFirstProof":{"type":"boolean"},"method":{"enum":["GET","POST","PATCH","PUT","DELETE"]},"path":{"type":"string"},"purpose":{"type":"string"},"write":{"type":"boolean"}},"required":["method","path","purpose","allowedForFirstProof","write"],"type":"object"},"minItems":1,"type":"array"},"explicitlyDeniedEndpoints":{"items":{"type":"string"},"type":"array"},"fieldOwnership":{"additionalProperties":false,"properties":{"deniedManualEdits":{"items":{"type":"string"},"type":"array"},"humanEditableSignals":{"items":{"type":"string"},"type":"array"},"surfaceopsOwned":{"items":{"type":"string"},"type":"array"}},"required":["surfaceopsOwned","humanEditableSignals","deniedManualEdits"],"type":"object"},"firstProofEnvironment":{"additionalProperties":true,"type":"object"},"manifestId":{"type":"string"},"persistence":{"additionalProperties":true,"type":"object"},"provenance":{"additionalProperties":false,"properties":{"generatedAt":{"const":"1970-01-01T00:00:00.000Z"},"generator":{"type":"string"},"sourceRefs":{"items":{"type":"string"},"type":"array"}},"required":["generatedAt","generator","sourceRefs"],"type":"object"},"realtime":{"additionalProperties":true,"type":"object"},"schemaId":{"const":"kanban-cards-api-manifest.v0"},"unsupportedCapabilities":{"items":{"type":"string"},"type":"array"},"upstreamProject":{"additionalProperties":true,"type":"object"},"version":{"const":"0.0.0"}},"required":["schemaId","version","manifestId","upstreamProject","firstProofEnvironment","auth","endpoints","explicitlyDeniedEndpoints","realtime","persistence","unsupportedCapabilities","fieldOwnership","authority","provenance"],"type":"object"}