{"auth":{"auth0DelegatedProduction":false,"localAdminBearerBootstrap":true,"scopedAgentTokens":true,"tokenRedactionRequired":true},"authority":{"kanbanCardsOwnsBoardPersistence":true,"kanbanCardsOwnsSurfaceOpsDecisions":false,"kanbanCardsOwnsSurfacesProofAuthority":false,"surfaceopsOwnsDecisions":true,"surfacesEvidenceRemainsProofAuthority":true},"endpoints":[{"allowedForFirstProof":true,"method":"GET","path":"/api/health","purpose":"health preflight","write":false},{"allowedForFirstProof":true,"method":"POST","path":"/api/boards","purpose":"bootstrap SurfaceOps approvals board","write":true},{"allowedForFirstProof":true,"method":"PATCH","path":"/api/boards/:boardId","purpose":"controlled board bootstrap updates only","write":true},{"allowedForFirstProof":true,"method":"GET","path":"/api/boards/:boardId","purpose":"read live board snapshot","write":false},{"allowedForFirstProof":true,"method":"POST","path":"/api/boards/:boardId/agent-sessions","purpose":"create scoped agent session during bootstrap","write":true},{"allowedForFirstProof":true,"method":"POST","path":"/api/boards/:boardId/work-items","purpose":"create card from SurfaceOps evidence","write":true},{"allowedForFirstProof":true,"method":"PATCH","path":"/api/boards/:boardId/work-items/:itemId","purpose":"move or update adapter projection fields","write":true},{"allowedForFirstProof":true,"method":"POST","path":"/api/boards/:boardId/work-items/:itemId/comments","purpose":"append collaboration comment","write":true},{"allowedForFirstProof":true,"method":"PATCH","path":"/api/boards/:boardId/work-items/:itemId/comments/:commentId","purpose":"update own comment status","write":true},{"allowedForFirstProof":true,"method":"GET","path":"/api/events","purpose":"SSE realtime workspace event stream","write":false},{"allowedForFirstProof":true,"method":"GET","path":"/api/boards/:boardId/events","purpose":"board and card event replay","write":false}],"explicitlyDeniedEndpoints":["PUT /api/state","POST /api/team/invites","DELETE /api/team/members/:memberId","POST /api/boards/:boardId/flow/ai-draft","POST /api/boards/:boardId/flow/apply","DELETE /api/boards/:boardId/agent-sessions/:sessionId"],"fieldOwnership":{"deniedManualEdits":["evidenceRefs","evidenceHashes","promotionStatus","decisionStatus","diagnosticCode","nonExecutable"],"humanEditableSignals":["comments","mentions","assignment","collaborationNotes"],"surfaceopsOwned":["reviewItemId","evidenceRefs","evidenceHashes","diagnosticCode","promotionStatus","decisionStatus","reviewerProvenance","handoffEligibility","nonExecutable"]},"firstProofEnvironment":{"allowedBaseUrlPattern":"^http://127\\.0\\.0\\.1:[0-9]+$","kind":"local-loopback","productionMutationAllowed":false},"manifestId":"kanban-cards-local-live-api-v0-projection","persistence":{"postgresProductionPathPlanned":true,"proofStartsWithFileStore":true,"surfaceopsOwnsMappingsAndAudit":true,"upstreamStoresBoardState":true},"provenance":{"generatedAt":"1970-01-01T00:00:00.000Z","generator":"interfacectl-surfaceops-kanban-live-api-projection","sourceRefs":["sources/surfaceops-kanban-live/kanban-cards-api-manifest.json","sources/surfaceops-kanban-live/kanban-cards-api-manifest.json"]},"realtime":{"browserBearerTransportAllowed":false,"cursorModes":["query-since","last-event-id"],"endpoint":"/api/events","refetchSnapshotBeforeReconcile":true,"transport":"server-sent-events"},"schemaId":"kanban-cards-api-manifest.v0","unsupportedCapabilities":["upstream-idempotency-key","etag-cas-revision","webhooks","custom-card-metadata","full-before-after-event-diff","scoped-service-account"],"upstreamProject":{"localWorkspaceHint":"../kanban.cards","modificationPolicy":"do-not-modify-upstream-source","name":"kanban.cards","pinnedCommit":"3b2a6f78693f0032439a1149eaed896f532aac09","role":"standalone-collaboration-board-substrate","sourceControl":"external-upstream"},"version":"0.0.0"}